<?xml version="1.0" encoding="UTF-8" standalone="no" ?>
<!DOCTYPE root SYSTEM "../package.dtd">

<root version="1.0">
   <!-- Extra Optional files for MK1x MKL2x MKL3x -->
   <projectActionList id="Options-file-list-MKLxxZ4">
      <applyWhen>
         <and>
            <or>
               <deviceSubfamilyIs>MKL14Z4</deviceSubfamilyIs>
               <deviceSubfamilyIs>MKL15Z4</deviceSubfamilyIs>
               <deviceSubfamilyIs>MKL16Z4</deviceSubfamilyIs>
               <deviceSubfamilyIs>MKL24Z4</deviceSubfamilyIs>
               <deviceSubfamilyIs>MKL25Z4</deviceSubfamilyIs>
               <deviceSubfamilyIs>MKL26Z4</deviceSubfamilyIs>
               <deviceSubfamilyIs>MKL34Z4</deviceSubfamilyIs>
               <deviceSubfamilyIs>MKL36Z4</deviceSubfamilyIs>
               <deviceSubfamilyIs>MKL46Z4</deviceSubfamilyIs>
            </or>
            <variableRef idRef="outputType" condition="matches" value=".*ProjectType\.exe$" />
         </and>
      </applyWhen>
      <!-- Clock -->
      <copy source="Startup_Code/clock-MCG-MKLxx.c"              target="Startup_Code/clock.c"              overwrite="always" />
      <copy source="Project_Headers/clock_configure-MCG-MKLxx.h" target="Project_Headers/clock_configure.h" overwrite="always" />
      <!-- Console -->
      <copy source="Startup_Code/console-mkl.c"    target="Startup_Code/console.c"    overwrite="always" />
      <copy source="Project_Headers/console.h"     target="Project_Headers/console.h" overwrite="always" />
   </projectActionList>
</root>