<?xml version="1.0" encoding="UTF-8" standalone="no" ?>
<!DOCTYPE root SYSTEM "package.dtd">

<root version="1.0" >
   <projectActionList id="CPP-abstraction-SPI" >
      <applyWhen>
         <and>
            <or>
               <deviceFamilyMatches>CortexM0</deviceFamilyMatches>
               <deviceFamilyMatches>CortexM0plus</deviceFamilyMatches>
               <deviceFamilyMatches>CortexM4</deviceFamilyMatches>
               <deviceFamilyMatches>CortexM4F</deviceFamilyMatches>
            </or>
            <variableRef idRef="cpp.peripheral.internal.spi" />
            <variableRef idRef="outputType" condition="matches" value=".*ProjectType\.exe$" />
         </and>
      </applyWhen>

      <projectActionList>
         <applyWhen>
            <variableRef idRef="projectOptionValue.CPP-abstraction" condition="isTrue"/>
         </applyWhen>
         <variable id="projectOptionValue.CPP-abstraction-SPI" 
            name="SPI interface" 
            description="Adds a CPP abstraction layer for SPI hardware" 
            checkGroup="group-peripheral-options" >
         </variable>
   
         <!-- MK SPI CPP abstraction layer -->
         <projectActionList>
            <projectActionList>
               <applyWhen>
                  <and>
                     <or>
                        <deviceFamilyMatches>CortexM4</deviceFamilyMatches>
                        <deviceFamilyMatches>CortexM4F</deviceFamilyMatches>
                     </or>
                     <variableRef idRef="projectOptionValue.CPP-abstraction-SPI" />
                  </and>
               </applyWhen>
               <copy source="Project_Headers/spi-MK.h"        target="Project_Headers/spi.h" />
               <copy source="Sources/spi-MK.cpp"              target="Sources/spi.cpp" />
            </projectActionList>
         </projectActionList>
         
         <!-- MKL SPI CPP abstraction layer -->
         <projectActionList>
            <projectActionList>
               <applyWhen>
                  <and>
                     <or>
                        <deviceFamilyMatches>CortexM0</deviceFamilyMatches>
                        <deviceFamilyMatches>CortexM0plus</deviceFamilyMatches>
                     </or>
                     <variableRef idRef="projectOptionValue.CPP-abstraction-SPI" />
                  </and>
               </applyWhen>
               <copy source="Project_Headers/spi-MKL.h"        target="Project_Headers/spi.h" />
               <copy source="Project_Headers/dma-MKL.h"        target="Project_Headers/dma.h" />
               <copy source="Sources/spi-MKL.cpp"              target="Sources/spi.cpp" />
               <copy source="Sources/dma-MKL.cpp"              target="Sources/dma.cpp" />
            </projectActionList>
         </projectActionList>
      </projectActionList>
   </projectActionList>
</root>
