<?xml version="1.0" encoding="UTF-8" standalone="no" ?>
<!DOCTYPE root SYSTEM "../package.dtd"
[
<!ENTITY usb-include-paths  SYSTEM "includes/00_00.usb_includes.xml">
]>

<root version="1.0" >
   <!-- Freescale group-ksdk-demos -->
   <projectActionList id="demo.KSDK-usb-host-msd-fatfs" root="">
      <applyWhen>
         <and>
            <variableRef idRef="demo.KSDK-usb-host-msd-fatfs" />
            <variableRef idRef="outputType" condition="matches" value=".*ProjectType\.exe$" />
         </and>
      </applyWhen>
      <projectActionList>
         <applyWhen>
            <and>
               <variableRef idRef="projectOptionValue.Kinetis-SDK-enable" />
               <or>
                  <variableRef idRef="projectOptionValue.Kinetis-SDK-os-bare-metal" />
                  <and>
                     <variableRef idRef="demo.KSDK-usb-with-rtos"/>
                     <or>
                        <variableRef idRef="projectOptionValue.Kinetis-SDK-os-free-rtos" />
                        <variableRef idRef="projectOptionValue.Kinetis-SDK-os-mqx" />
                        <variableRef idRef="projectOptionValue.Kinetis-SDK-os-ucosii" />
                        <variableRef idRef="projectOptionValue.Kinetis-SDK-os-ucosiii" />
                     </or>
                  </and>
               </or>
            </and>
         </applyWhen>
         <variable id="projectOptionValue.KSDK-usb-host-msd-fatfs" 
            name="USB Host MSD FATFS example" 
            description="The board will transfer data from an attached USB FAT formatted disk"
            radioGroup="group-ksdk-demo" >
         </variable>
         <projectActionList>
            <applyWhen>
               <variableRef idRef="projectOptionValue.KSDK-usb-host-msd-fatfs" />
            </applyWhen>
            <deleteResource target="Sources/main.c" />
         
            <copy source="usbdm_kds_path/examples/$(demo.KDS.boardName)/demo_apps/usb/host/msd/msd_fatfs/readme.pdf" type="link" target="doc/readme.pdf"      sourcePathType="absolute" />
   
            <copy source="usbdm_kds_path/examples/$(demo.KDS.boardName)/demo_apps/usb/host/msd/msd_fatfs/hardware_init.c"    target="board/hardware_init.c"   sourcePathType="absolute" />
            
            <copy source="usbdm_kds_path/middleware/filesystem/fatfs/fsl_usb_disk/src/msd_diskio.c"          target="Sources/msd_diskio.c"                 sourcePathType="absolute" />
            <copy source="usbdm_kds_path/middleware/filesystem/fatfs/fsl_usb_disk/msd_diskio.h"              target="Sources/msd_diskio.h"                 sourcePathType="absolute" />
   
            <copy source="usbdm_kds_path/middleware/filesystem/fatfs/diskio.c"            target="Sources/fatfs/diskio.c"  sourcePathType="absolute" />
            <copy source="usbdm_kds_path/middleware/filesystem/fatfs/diskio.h"            target="Sources/fatfs/diskio.h"  sourcePathType="absolute" />
            <copy source="usbdm_kds_path/middleware/filesystem/fatfs/ff.c"                target="Sources/fatfs/ff.c"      sourcePathType="absolute" />
            <copy source="usbdm_kds_path/middleware/filesystem/fatfs/ff.h"                target="Sources/fatfs/ff.h"      sourcePathType="absolute" />
            <copy source="usbdm_kds_path/middleware/filesystem/fatfs/ffconf.h"            target="Sources/fatfs/ffconf.h"  sourcePathType="absolute" />
            <copy source="usbdm_kds_path/middleware/filesystem/fatfs/option/unicode.c"    target="Sources/fatfs/option/unicode.c" sourcePathType="absolute" />
   
            <copy source="usbdm_kds_path/examples/$(demo.KDS.boardName)/demo_apps/usb/host/msd/msd_fatfs/main.c"          target="Sources/main.c"                 sourcePathType="absolute" />
            <copy source="usbdm_kds_path/examples/$(demo.KDS.boardName)/demo_apps/usb/host/msd/msd_fatfs/msd_fat_demo.c"  target="Sources/msd_fat_demo.c"         sourcePathType="absolute" />

            <!-- C Include paths -->
            <projectOption id="net.sourceforge.usbdm.gnu.c.compiler.option.include.paths">
               &usb-include-paths;
               <value>&quot;${workspace_loc:/${ProjName}/Sources/fatfs}&quot;</value>
            </projectOption>
            
            <!-- C++ Include paths -->
            <projectOption id="net.sourceforge.usbdm.gnu.cpp.compiler.option.include.paths">
               &usb-include-paths;
               <value>&quot;${workspace_loc:/${ProjName}/Sources/fatfs}&quot;</value>
            </projectOption>
         <!-- C Defines -->
         <projectOption id="net.sourceforge.usbdm.gnu.c.compiler.option.preprocessor.def.symbols">
            <value>USB_DISK_ENABLE=1</value>
         </projectOption>
         <!-- C++ Defines -->
         <projectOption id="net.sourceforge.usbdm.gnu.cpp.compiler.option.preprocessor.def.symbols">
            <value>USB_DISK_ENABLE=1</value>
         </projectOption>
            <!-- C Link options -->
            <projectOption id="gnu.c.link.option.other" overwrite="always">
               <value>&quot;--defsym=__ram_vector_table__=1&quot;</value>
            </projectOption>
            <!-- C++ Link options -->
            <projectOption id="gnu.cpp.link.option.other" overwrite="always">
               <value>&quot;--defsym=__ram_vector_table__=1&quot;</value>
            </projectOption>
         </projectActionList>
      </projectActionList>
   </projectActionList>
</root>
