<?xml version="1.0" encoding="UTF-8" standalone="no" ?>
<!DOCTYPE root SYSTEM "../package.dtd">

<root version="1.0" >
   <projectActionList id="CPP-abstraction-SSD1306_OLED" >
      <applyWhen>
         <and>
            <or>
               <deviceFamilyMatches>CortexM0</deviceFamilyMatches>
               <deviceFamilyMatches>CortexM0plus</deviceFamilyMatches>
               <deviceFamilyMatches>CortexM4</deviceFamilyMatches>
               <deviceFamilyMatches>CortexM4F</deviceFamilyMatches>
            </or>
            <variableRef idRef="cpp.peripheral.internal.i2c" />
            <variableRef idRef="outputType" condition="matches" value=".*ProjectType\.exe$" />
         </and>
      </applyWhen>
      <projectActionList>
         <applyWhen>
            <variableRef idRef="projectOptionValue.CPP-abstraction" condition="isTrue"/>
         </applyWhen>
         <variable id="projectOptionValue.CPP-abstraction-SSD1306_OLED" 
            name="SSD1306_OLED C++ interface" 
            description="Adds a CPP abstraction layer for a SSD1306 based OLED" 
            checkGroup="group-i2c-peripheral-options" >
         </variable>
   
         <!-- I2C CPP abstraction layer -->
         <projectActionList>
            <projectActionList>
               <applyWhen >
                  <variableRef idRef="projectOptionValue.CPP-abstraction-SSD1306_OLED" />
               </applyWhen>
               <copy source="Snippets/oled-example.cpp"     target="Snippets/oled-example.cpp"  overwrite="true" />
               <copy source="Snippets/fonts.h"              target="Sources/fonts.h"            overwrite="true" />
               <copy source="Snippets/fonts.cpp"            target="Sources/fonts.cpp"          overwrite="true" />
               <copy source="Snippets/oled.h"               target="Sources/oled.h"             overwrite="true" />
               <copy source="Snippets/oled.cpp"             target="Sources/oled.cpp"           overwrite="true" />
            </projectActionList>
         </projectActionList>
      </projectActionList>
    </projectActionList>
</root>
