<?xml version="1.0" encoding="UTF-8" standalone="no" ?>
<!DOCTYPE root SYSTEM "package.dtd">

<root version="1.0" >
   <projectActionList id="CPP-abstraction-HMC5883L" >
      <applyWhen>
         <and>
            <or>
               <deviceFamilyMatches>CortexM0</deviceFamilyMatches>
               <deviceFamilyMatches>CortexM0plus</deviceFamilyMatches>
               <deviceFamilyMatches>CortexM4</deviceFamilyMatches>
               <deviceFamilyMatches>CortexM4F</deviceFamilyMatches>
            </or>
            <variableRef idRef="cpp.peripheral.internal.i2c" />
            <variableRef idRef="outputType" condition="matches" value=".*ProjectType\.exe$" />
         </and>
      </applyWhen>
      <projectActionList>
         <applyWhen>
            <variableRef idRef="projectOptionValue.CPP-abstraction" condition="isTrue"/>
         </applyWhen>
         <variable id="projectOptionValue.CPP-abstraction-HMC5883L" 
            name="HMC5883L C++ interface" 
            description="Adds a CPP abstraction layer for HMC5883L accelerometer" 
            checkGroup="group-i2c-peripheral-options" >
         </variable>
   
         <!-- I2C CPP abstraction layer -->
         <projectActionList>
            <projectActionList>
               <applyWhen >
                  <variableRef idRef="projectOptionValue.CPP-abstraction-HMC5883L" />
               </applyWhen>
               <copy source="Snippets/hmc5883l-example.cpp"     target="Snippets/hmc5883l-example.cpp" />
               <copy source="Project_Headers/hmc5883l.h"        target="Project_Headers/hmc5883l.h" />
               <copy source="Sources/hmc5883l.cpp"              target="Sources/hmc5883l.cpp" />
            </projectActionList>
         </projectActionList>
      </projectActionList>
    </projectActionList>
</root>
