<?xml version="1.0" encoding="UTF-8" standalone="no" ?>
<!DOCTYPE root SYSTEM "../package.dtd">

<root version="1.0" >
   <projectActionList id="CPP-abstraction-TFT-IL9488" >
      <applyWhen>
         <and>
            <or>
               <deviceFamilyMatches>CortexM0</deviceFamilyMatches>
               <deviceFamilyMatches>CortexM0plus</deviceFamilyMatches>
               <deviceFamilyMatches>CortexM4</deviceFamilyMatches>
               <deviceFamilyMatches>CortexM4F</deviceFamilyMatches>
            </or>
            <variableRef idRef="cpp.peripheral.internal.spi" />
            <variableRef idRef="outputType" condition="matches" value=".*ProjectType\.exe$" />
         </and>
      </applyWhen>
      <projectActionList>
         <applyWhen>
            <variableRef idRef="projectOptionValue.CPP-abstraction" condition="isTrue"/>
         </applyWhen>
         <variable id="projectOptionValue.CPP-abstraction-TFT-IL9488"
            name='IL9488 based TFT interface'
            description="Adds a CPP abstraction layer for an IL9488 display"
            checkGroup="group-spi-peripheral-options" >
         </variable>

         <!-- LCD CPP abstraction layer -->
         <projectActionList>
            <projectActionList>
               <applyWhen >
                  <variableRef idRef="projectOptionValue.CPP-abstraction-TFT-IL9488" />
               </applyWhen>
               <copy source="Fonts"                               target="Fonts"                               overwrite="true"/>
               <copy source="Snippets/fonts.h"                    target="Sources/fonts.h"                     overwrite="true"/>
               <copy source="Snippets/tft_IL9488.h"               target="Sources/tft_IL9488.h"                overwrite="true"/>
               <copy source="Snippets/tft-example-IL9488.cpp"     target="Sources/tft-example-IL9488.cpp"      overwrite="true"/>
               <excludeSourceFile target="Sources/tft-example-IL9488.cpp"  />
               <projectOption id="net.sourceforge.usbdm.gnu.c.compiler.option.preprocessor.def.symbols">
                  <value>EPAPER_AVAILABLE</value>
               </projectOption>
               <projectOption id="net.sourceforge.usbdm.gnu.cpp.compiler.option.preprocessor.def.symbols">
                  <value>EPAPER_AVAILABLE</value>
               </projectOption>
            </projectActionList>
         </projectActionList>
      </projectActionList>
    </projectActionList>
</root>
