<?xml version="1.0" encoding="UTF-8" standalone="no" ?>
<!DOCTYPE root SYSTEM "../package.dtd">

<root version="1.0">
   <!-- Extra Optional files for MKE02M2 -->
   <projectActionList id="Options-file-list-MKE02Z2">
      <applyWhen>
         <and>
            <deviceSubfamilyIs>MKE02Z2</deviceSubfamilyIs>
            <variableRef idRef="outputType" condition="matches" value=".*ProjectType\.exe$" />
         </and>
      </applyWhen>
      <variable id="projectOptionValue.Clock-setup" 
         name="Clock setup code" 
         description="Adds code for basic clock initialization - check assumptions made"
         checkGroup="group-additional-options"/>
      <variable id="projectOptionValue.UART-setup" 
         name="UART setup code" 
         description="Adds C stdio (UART) support for newlib"          
         checkGroup="group-additional-options" >
         <enableWhen>
            <requirement idRef="projectOptionValue.Clock-setup"/>
         </enableWhen>
      </variable>
      
      <projectActionList>
         <applyWhen>
            <variableRef idRef="projectOptionValue.Clock-setup" />
         </applyWhen>
         <copy source="Startup_Code/clock-MKE0x.c" target="Startup_Code/clock.c" />
         <copy source="Project_Headers/clock_configure-MKE02M2.h" target="Project_Headers/clock_configure.h" />
      </projectActionList>
      <projectActionList>
         <applyWhen>
            <variableRef idRef="projectOptionValue.UART-setup" />
         </applyWhen>
         <copy source="Startup_Code/console-mke.c" target="Startup_Code/console.c" />
         <copy source="Project_Headers/console.h" target="Project_Headers/console.h" />
      </projectActionList>
   </projectActionList>
</root>